{
  "source": {
    "skill": "client_intake",
    "adapter_version": "v1",
    "profile_path": "01-client-intake/clients/C304-multi-scope/CLIENT_PROFILE.md",
    "pending_path": "01-client-intake/clients/C304-multi-scope/PENDING.md",
    "conversation_log_path": "01-client-intake/clients/C304-multi-scope/CONVERSATION_LOG.md",
    "intake_complete": true
  },
  "analysis_scope": ["life", "medical", "critical_illness"],
  "client_profile": {
    "facts": [
      { "field": "annual_income", "value": "80万", "value_status": "KNOWN", "source_round": "R1", "source_text": "年收入80万", "source_section": "Confirmed Facts" },
      { "field": "age", "value": "38", "value_status": "KNOWN", "source_round": "R1", "source_text": "38岁", "source_section": "Confirmed Facts" },
      { "field": "family_responsibility", "value": "已婚+2个孩子", "value_status": "KNOWN", "source_round": "R1", "source_text": "已婚有两个孩子", "source_section": "Confirmed Facts" },
      { "field": "mortgage_balance", "value": "220万", "value_status": "KNOWN", "source_round": "R1", "source_text": "房贷220万", "source_section": "Confirmed Facts" },
      { "field": "children_info", "value": "2个孩子", "value_status": "KNOWN", "source_round": "R1", "source_text": "有两个孩子", "source_section": "Confirmed Facts" },
      { "field": "spouse_income", "value": "10万", "value_status": "KNOWN", "source_round": "R1", "source_text": "配偶收入10万", "source_section": "Confirmed Facts" },
      { "field": "customer_health", "value": "健康", "value_status": "KNOWN", "source_round": "R2", "source_text": "目前健康", "source_section": "Confirmed Facts" },
      { "field": "social_insurance_status", "value": "社保医保正常", "value_status": "KNOWN", "source_round": "R2", "source_text": "社保医保正常", "source_section": "Confirmed Facts" },
      { "field": "existing_medical_coverage", "value": "公司医疗险", "value_status": "KNOWN", "source_round": "R2", "source_text": "公司有医疗险", "source_section": "Confirmed Facts" },
      { "field": "budget", "value": "每年3万", "value_status": "KNOWN", "source_round": "R2", "source_text": "预算每年3万", "source_section": "Confirmed Facts" },
      { "field": "existing_life_coverage", "value": "已有定寿100万", "value_status": "KNOWN", "source_round": "R2", "source_text": "已有定寿100万", "source_section": "Confirmed Facts" },
      { "field": "existing_critical_illness_coverage", "value": "已有重疾50万", "value_status": "KNOWN", "source_round": "R2", "source_text": "已有重疾50万", "source_section": "Confirmed Facts" }
    ],
    "inferred_notes": [],
    "follow_up_items": ["care_preference", "family_financial_status", "parents_support"],
    "handoff_notes": "多 scope 优先级测试"
  },
  "conflicts": [],
  "constraints": [],
  "metadata": {
    "client_id": "C304",
    "client_alias": "multi-scope"
  },
  "question_context": {
    "asked_questions": [],
    "answered_fields": []
  }
}
