{
  "source": {
    "skill": "client_intake",
    "adapter_version": "v1",
    "profile_path": "client-intake-data/clients/C302-life-preliminary/CLIENT_PROFILE.md",
    "pending_path": "client-intake-data/clients/C302-life-preliminary/PENDING.md",
    "conversation_log_path": "client-intake-data/clients/C302-life-preliminary/CONVERSATION_LOG.md",
    "intake_complete": true
  },
  "analysis_scope": ["life"],
  "client_profile": {
    "facts": [
      { "field": "annual_income", "value": "60万", "value_status": "KNOWN", "source_round": "R1", "source_text": "年收入60万", "source_section": "Confirmed Facts" },
      { "field": "family_responsibility", "value": "已婚+1个孩子", "value_status": "KNOWN", "source_round": "R1", "source_text": "已婚有一个孩子", "source_section": "Confirmed Facts" },
      { "field": "mortgage_balance", "value": "150万", "value_status": "KNOWN", "source_round": "R1", "source_text": "房贷150万", "source_section": "Confirmed Facts" },
      { "field": "children_info", "value": "1个孩子，5岁", "value_status": "KNOWN", "source_round": "R1", "source_text": "孩子5岁", "source_section": "Confirmed Facts" },
      { "field": "spouse_income", "value": "20万", "value_status": "KNOWN", "source_round": "R1", "source_text": "配偶收入20万", "source_section": "Confirmed Facts" },
      { "field": "parents_support", "value": "偶尔支持父母", "value_status": "KNOWN", "source_round": "R2", "source_text": "偶尔支持父母", "source_section": "Confirmed Facts" },
      { "field": "assets", "value": "30万存款", "value_status": "KNOWN", "source_round": "R2", "source_text": "30万存款", "source_section": "Confirmed Facts" }
    ],
    "inferred_notes": [],
    "follow_up_items": ["existing_life_coverage", "annual_expense"],
    "handoff_notes": "life 初步分析样例"
  },
  "conflicts": [],
  "constraints": [],
  "metadata": {
    "client_id": "C302",
    "client_alias": "life-preliminary"
  },
  "question_context": {
    "asked_questions": [],
    "answered_fields": []
  }
}
