{
  "source": {
    "skill": "client_intake",
    "adapter_version": "v1",
    "profile_path": "client-intake-data/clients/C201-优先级样例/CLIENT_PROFILE.md",
    "pending_path": "client-intake-data/clients/C201-优先级样例/PENDING.md",
    "conversation_log_path": "client-intake-data/clients/C201-优先级样例/CONVERSATION_LOG.md",
    "intake_complete": true
  },
  "analysis_scope": ["medical"],
  "client_profile": {
    "facts": [
      { "field": "age", "value": "35", "value_status": "KNOWN", "source_round": "R1", "source_text": "35岁", "source_section": "Confirmed Facts" },
      { "field": "customer_health", "value": "健康", "value_status": "KNOWN", "source_round": "R1", "source_text": "目前健康", "source_section": "Confirmed Facts" },
      { "field": "existing_medical_coverage", "value": "公司有团险", "value_status": "KNOWN", "source_round": "R2", "source_text": "公司有团险", "source_section": "Confirmed Facts" }
    ],
    "inferred_notes": [],
    "follow_up_items": [],
    "handoff_notes": "medical 问题优先级测试"
  },
  "conflicts": [],
  "constraints": [],
  "metadata": {
    "client_id": "C201",
    "client_alias": "优先级样例"
  },
  "question_context": {
    "asked_questions": [],
    "answered_fields": []
  }
}
