{
  "source": {
    "skill": "client_intake",
    "adapter_version": "v1",
    "profile_path": "client-intake-data/clients/C203-多轮补充/CLIENT_PROFILE.md",
    "pending_path": "client-intake-data/clients/C203-多轮补充/PENDING.md",
    "conversation_log_path": "client-intake-data/clients/C203-多轮补充/CONVERSATION_LOG.md",
    "intake_complete": true
  },
  "analysis_scope": ["savings"],
  "client_profile": {
    "facts": [
      { "field": "annual_income", "value": "50万", "value_status": "KNOWN", "source_round": "R1", "source_text": "年收入50万", "source_section": "Confirmed Facts" },
      { "field": "annual_expense", "value": "30万", "value_status": "KNOWN", "source_round": "R1", "source_text": "一年开支30万", "source_section": "Confirmed Facts" },
      { "field": "liabilities", "value": "房贷100万", "value_status": "KNOWN", "source_round": "R1", "source_text": "房贷100万", "source_section": "Confirmed Facts" },
      { "field": "cash_flow", "value": "有结余", "value_status": "KNOWN", "source_round": "R1", "source_text": "每年有一些结余", "source_section": "Confirmed Facts" }
    ],
    "inferred_notes": [],
    "follow_up_items": [],
    "handoff_notes": "多轮补充测试"
  },
  "conflicts": [],
  "constraints": [],
  "metadata": {
    "client_id": "C203",
    "client_alias": "多轮补充"
  },
  "question_context": {
    "asked_questions": [],
    "answered_fields": []
  }
}
